{
  "protocolVersion": "1.0",
  "transferId": "tx-file-01J2M8X0E11Y0Y9QVT38A0BHR5",
  "transferType": "FILE",
  "senderDeviceId": "bd-macos-01J2M8Q8RXE4KZ9G7V1N0Q4F2A",
  "senderPublicKey": "MCowBQYDK2VuAyEAtqzFJY2dveH2WrN9q9NqbcMTFq0QnV8DScjQ7kSy3xY=",
  "receiverDeviceId": "bd-windows-01J2M8W7Z6HD1DYQKFE1X6V904",
  "createdAt": "2026-07-06T14:27:18Z",
  "requiresApproval": true,
  "resumeSupported": true,
  "payloadMetadata": {
    "fileName": "BeamDrop-Q3-demo.mov",
    "mimeType": "video/quicktime",
    "sizeBytes": 187904819,
    "chunkSize": 4194304,
    "totalChunks": 45,
    "sha256": "6f1d2d9a8b0f73643d20e6f8bdbbcf46c2cf4bfb2f8b2c4ed4db70d49c9b3b2a",
    "resumeToken": "resume-01J2M8X3GMC2HEK0MJWQTQ3K3T"
  }
}
